{"blyg":"0.3","id":"53am1pbn2926j81e34ppxpe8z8","kind":"fragment","version":2,"at":"2026-10-04T02:41:47Z","note":"typo","pinned":true,"origin":"https://studio.example/","author":{"name":"Tester","url":"https://studio.example/"},"content_md":"First draft of a claim, typo fixed.","content_html":"<p>First draft of a claim, typo fixed.</p>\n","content_hash":"sha256:601551663a536edfb6ffe6da2e76a95f47521f721617123d1717b9a12124bc3d"}