{"blyg":"0.3","id":"7zxpxc8fyfhqx7pf3c3qwqm80k","kind":"thread","version":1,"at":"2026-10-04T03:41:54Z","note":null,"pinned":true,"origin":"https://studio.example/","author":{"name":"Tester","url":"https://studio.example/"},"content_md":"Generated summary sentence from the fake provider.\n\nAfterword by the author.","content_html":"<div class=\"blyg-tk-gen\"><p>Generated summary sentence from the fake provider.</p>\n</div>\n<p>Afterword by the author.</p>\n","content_hash":"sha256:7c002d2d3316c82a4074518f36e5578b49866813128574328d41e81f94a321d1","transclusions":[],"generated":[{"sources":[{"id":"3c25ekpq3dvy0a1fa7bjfjkzm5","version":1}],"model":"fake-model-1","at":"2026-10-04T03:41:54Z"}]}