{"blyg":"0.3","id":"0nwjj3kgvym48x7e1bbc36x6xz","kind":"fragment","version":1,"at":"2026-10-04T03:41:54Z","note":null,"pinned":true,"origin":"https://studio.example/","author":{"name":"Tester","url":"https://studio.example/"},"content_md":"Soon to be withdrawn.","content_html":"<p>Soon to be withdrawn.</p>\n","content_hash":"sha256:346abb7a3fb8849e863022a300e6bbd17eaa74b42d41899b6ff641ae08653798"}