{"blyg":"0.3","id":"5w1fd72f6nbfgcasewbmzcgrm1","kind":"fragment","version":2,"at":"2026-09-12T18:36:05Z","note":null,"pinned":true,"origin":"https://venkateshrao.com/blyg/","author":{"name":"Venkatesh Rao","url":"https://venkateshrao.com/blyg/"},"content_md":"Premature ontogenic closure is the root of all prophetic evil.\n\nThe line is stolen, of course. Donald Knuth, writing in 1974 about the discipline of computer programming, warned that \"premature optimization is the root of all evil\" — meaning that a programmer who tunes his code before he knows where the time is actually spent will spend his effort polishing the parts that never mattered, and will have made the whole thing harder to change by the time he finds out. Measure first; commit late.","content_html":"<p>Premature ontogenic closure is the root of all prophetic evil.</p>\n<div class=\"blyg-tk-gen\"><p>The line is stolen, of course. Donald Knuth, writing in 1974 about the discipline of computer programming, warned that &quot;premature optimization is the root of all evil&quot; — meaning that a programmer who tunes his code before he knows where the time is actually spent will spend his effort polishing the parts that never mattered, and will have made the whole thing harder to change by the time he finds out. Measure first; commit late.</p>\n</div>\n","content_hash":"sha256:d7ec8286df4741310f79a981521d98584264a794b2b4d31489bf3f3d767202ba","generated":[{"sources":[],"model":"claude-opus-5","at":"2026-09-11T20:16:16Z"}]}