{"blyg":"0.3","id":"3gevqg3gqvp0bm4mzqnh7zk46t","kind":"thread","version":1,"at":"2026-10-04T03:30:57Z","note":null,"pinned":true,"origin":"https://studio.example/","author":{"name":"Tester","url":"https://studio.example/"},"content_md":"Intro to the thread.\n\n> Local source fragment about gardens and paths.\n>\n> — quoted from [studio.example · v1](https://studio.example/f/6xsbc7qg69h56emfmhmn0e523x/)\n\n> धर्म और कर्म — यह माध्यम ही संदेश है। The medium is the message.\n>\n> — quoted from [source.example · v1](https://source.example/f/1vgtgz0gq5b2c9k7d3m8r4n6xy/)\n\n> Stigmergy is what a protocol looks like from inside\n>\n> — quoted from [source.example · v2](https://source.example/f/7c9wk2mhq0v3xj8tn5rzfd41bg/)\n\nSee also [[4zss0yg5f5zbh48e22s4f87003]] and [[6xsbc7qg69h56emfmhmn0e523x]].\n\n```\n![[7c9wk2mhq0v3xj8tn5rzfd41bg]]\n```","content_html":"<p>Intro to the thread.</p>\n<blockquote>\n<p>Local source fragment about gardens and paths.</p>\n<p>— quoted from <a href=\"https://studio.example/f/6xsbc7qg69h56emfmhmn0e523x/\">studio.example · v1</a></p>\n</blockquote>\n<blockquote>\n<p>धर्म और कर्म — यह माध्यम ही संदेश है। The medium is the message.</p>\n<p>— quoted from <a href=\"https://source.example/f/1vgtgz0gq5b2c9k7d3m8r4n6xy/\">source.example · v1</a></p>\n</blockquote>\n<blockquote>\n<p>Stigmergy is what a protocol looks like from inside</p>\n<p>— quoted from <a href=\"https://source.example/f/7c9wk2mhq0v3xj8tn5rzfd41bg/\">source.example · v2</a></p>\n</blockquote>\n<p>See also <a href=\"https://source.example/t/4zss0yg5f5zbh48e22s4f87003/\">“Opening line of a remote thread. Stigmergy is what a protoco…”</a> and <a href=\"https://studio.example/f/6xsbc7qg69h56emfmhmn0e523x/\">“Local source fragment about gardens and paths.”</a>.</p>\n<pre><code>![[7c9wk2mhq0v3xj8tn5rzfd41bg]]\n</code></pre>\n","content_hash":"sha256:c5c4561ec3edd3e0e8374de5292ed0242ae00f079b1ff95e5ed969d4a0929b43","transclusions":[],"forked_from":{"origin":"https://studio.example/","id":"1mynqvp9sryh20sd493kbb093v","version":1,"cited":{"source":"Studio Under Test","excerpt":"Intro to the thread. Local source fragment about gardens and paths. धर्म और कर्म…","url":"https://studio.example/t/1mynqvp9sryh20sd493kbb093v/v1/","retrieved":"2026-10-04T03:30:57Z"}}}